{
  "digital_twin_id": "dt-101-2026-04-24T10:30:00Z",
  "schema_version": "digital-twin-v0.1",
  "generated_at": "2026-04-24T10:30:00Z",
  "vehicle": {
    "id": 101,
    "user_id": 7,
    "brand": "Toyota",
    "model": "Camry",
    "year": 2018,
    "vin": "JTDBE32K123456789",
    "mileage_km": 128500,
    "created_at": "2026-01-03T12:00:00Z",
    "updated_at": "2026-04-24T10:30:00Z"
  },
  "timeline": {
    "taxonomy_version": "timeline-taxonomy-v0.1",
    "events": [
      {
        "id": 1001,
        "vehicle_id": 101,
        "type": "inspection",
        "title": "Pre-service inspection",
        "description": "Technician inspected brake pads, tires, and fluid levels before scheduled service.",
        "mileage_km": 128100,
        "cost": 0.0,
        "event_date": "2026-04-02T09:30:00Z",
        "source": "service_center",
        "source_id": "inspection-7781",
        "metadata": {
          "inspection_result": "attention_required",
          "checked_components": [
            "brake_pads",
            "tires",
            "engine_oil"
          ],
          "next_check_due": "2026-07-02"
        }
      },
      {
        "id": 1003,
        "vehicle_id": 101,
        "type": "recall",
        "title": "Fuel pump recall notice",
        "description": "Manufacturer recall opened for fuel pump inspection and replacement if required.",
        "mileage_km": null,
        "cost": 0.0,
        "event_date": "2026-04-15T00:00:00Z",
        "source": "manufacturer_recall_feed",
        "source_id": "26V123000",
        "metadata": {
          "recall_id": "26V123000",
          "status": "open",
          "component": "fuel_system",
          "remedy": "Inspect fuel pump and replace if defective.",
          "manufacturer": "Example Motors"
        }
      },
      {
        "id": 1004,
        "vehicle_id": 101,
        "type": "warning",
        "title": "Check engine warning",
        "description": "Driver reported intermittent check engine light during cold starts.",
        "mileage_km": 128420,
        "cost": null,
        "event_date": "2026-04-21T07:40:00Z",
        "source": "owner_report",
        "source_id": "warning-2231",
        "metadata": {
          "warning_code": "check_engine",
          "severity": "medium",
          "system": "engine",
          "is_active": true
        }
      },
      {
        "id": 1005,
        "vehicle_id": 101,
        "type": "maintenance",
        "title": "Engine oil replacement",
        "description": "Scheduled oil and oil filter replacement completed.",
        "mileage_km": 128500,
        "cost": 85.0,
        "event_date": "2026-04-23T11:00:00Z",
        "source": "service_center",
        "source_id": "work-order-9912",
        "metadata": {
          "service_name": "Oil service",
          "part_category": "engine_oil",
          "parts_replaced": [
            "engine_oil",
            "oil_filter"
          ],
          "service_provider": "Fit Service"
        }
      },
      {
        "id": 1007,
        "vehicle_id": 101,
        "type": "diagnostic",
        "title": "OBD scan completed",
        "description": "Diagnostic scanner found oxygen sensor and misfire history codes.",
        "mileage_km": 128510,
        "cost": 35.0,
        "event_date": "2026-04-24T10:20:00Z",
        "source": "diagnostic_tool",
        "source_id": "scan-5520",
        "metadata": {
          "dtc_codes": [
            "P0133",
            "P0301"
          ],
          "system": "engine",
          "tool_name": "OBD-II scanner",
          "result": "codes_found"
        }
      }
    ]
  },
  "parts_health": {
    "model_version": "parts-health-v0.1",
    "parts": [
      {
        "model_version": "parts-health-v0.1",
        "part_category": "engine_oil",
        "part_name": "Engine oil",
        "health_score": 70,
        "risk_level": "medium",
        "current_mileage_km": 128500,
        "mileage_since_service_km": 8500,
        "remaining_km": 1500,
        "recommendation": "Oil replacement will be required soon."
      },
      {
        "model_version": "parts-health-v0.1",
        "part_category": "brake_pads",
        "part_name": "Brake pads",
        "health_score": 88,
        "risk_level": "low",
        "current_mileage_km": 128500,
        "mileage_since_service_km": 28000,
        "remaining_km": 12000,
        "recommendation": "Brake pads are within normal wear range."
      },
      {
        "model_version": "parts-health-v0.1",
        "part_category": "timing_belt",
        "part_name": "Timing belt",
        "health_score": 32,
        "risk_level": "high",
        "current_mileage_km": 128500,
        "mileage_since_service_km": 90500,
        "remaining_km": -500,
        "recommendation": "Immediate timing belt inspection and replacement are recommended."
      }
    ]
  },
  "predictions": {
    "model_version": "maintenance-v1.2.0",
    "source": "ml_service",
    "items": [
      {
        "id": 501,
        "vehicle_id": 101,
        "part_code": "engine_oil",
        "part_category": "engine_oil",
        "part_name": "Engine oil",
        "risk_level": "medium",
        "risk_score": 65,
        "remaining_km": 1500,
        "remaining_days": 45,
        "predicted_next_mileage": 130000,
        "predicted_next_date": "2026-08-01",
        "probability": 0.72,
        "recommendation": "Maintenance will be required soon.",
        "explanation": "8500 km have passed since the last oil change, so the maintenance risk is increased.",
        "created_at": "2026-04-24T10:25:00Z"
      },
      {
        "id": 502,
        "vehicle_id": 101,
        "part_code": "timing_belt",
        "part_category": "timing_belt",
        "part_name": "Timing belt",
        "risk_level": "high",
        "risk_score": 98,
        "remaining_km": -500,
        "remaining_days": 0,
        "predicted_next_mileage": 128000,
        "predicted_next_date": "2026-04-24",
        "probability": 0.98,
        "recommendation": "Inspect and replace the timing belt immediately.",
        "explanation": "The timing belt is past its expected service interval and has recent repair history.",
        "created_at": "2026-04-24T10:25:00Z"
      }
    ]
  },
  "summary": {
    "overall_risk_level": "high",
    "highest_risk_parts": [
      "timing_belt"
    ],
    "open_warnings_count": 1,
    "open_recalls_count": 1,
    "latest_event_date": "2026-04-24T10:20:00Z",
    "next_recommended_actions": [
      "Inspect and replace the timing belt immediately.",
      "Resolve open fuel pump recall.",
      "Investigate active check engine warning."
    ]
  }
}
